{
  "simulation_id": "sim.air-traffic.0001",
  "simulation_type": "arrival_conflict_analysis",
  "status": "completed",
  "scenario_name": "Weather-driven arrival conflict resolution",
  "assumptions": [
    "runway 10C/28C remains closed",
    "holding pattern can absorb 20-25 minutes"
  ],
  "inputs": {
    "flight_id": "flight.ual2187",
    "conflicting_proposals": [
      "proposal.air-traffic.unsafe.0001",
      "proposal.air-traffic.safe.0002"
    ]
  },
  "outcomes": {
    "unsafe_proposal_risk": "runway_incursion_high",
    "safe_proposal_risk": "managed_delay",
    "recommended_proposal_id": "proposal.air-traffic.safe.0002"
  },
  "created_at": "2026-03-09T08:12:30Z"
}
