{
  "simulation_id": "sim.city-ops.0001",
  "simulation_type": "cross_agency_incident_analysis",
  "status": "completed",
  "scenario_name": "Flooded loop corridor response",
  "assumptions": [
    "transit bus bridges can be staged within 25 minutes",
    "water contamination testing remains incomplete for the first response hour"
  ],
  "inputs": {
    "incident_id": "incident.city-ops.0001",
    "conflicting_proposals": [
      "proposal.city-ops.0001",
      "proposal.city-ops.unsafe.0002",
      "proposal.city-ops.targeted.0003"
    ]
  },
  "outcomes": {
    "recommended_proposal_id": "proposal.city-ops.targeted.0003",
    "projected_residents_displaced": 4200,
    "projected_service_restoration_hours": 9,
    "hospital_access_maintained": true
  },
  "created_at": "2026-03-23T11:18:30Z"
}
