{
  "simulation_id": "sim.delay-response.0001",
  "simulation_type": "what_if_operational_response",
  "status": "completed",
  "scenario_name": "Reroute delayed shipment",
  "assumptions": [
    "alternate route is available"
  ],
  "inputs": {
    "shipment_id": "shipment.88421"
  },
  "outcomes": {
    "baseline_output_loss_percent": 17,
    "simulated_output_loss_percent": 4
  },
  "created_at": "2026-03-08T11:20:05Z"
}
